{
  "$schema": "../schemas/profile.schema.json",
  "id": "google-pixel-10-pro-fold",
  "revision": 1,
  "kind": "device",
  "platform": "android",
  "name": "Google Pixel 10 Pro Fold",
  "vendor": "Google",
  "sources": [
    {
      "id": "google-pixel-specs",
      "url": "https://support.google.com/pixelphone/answer/7158570",
      "publisher": "Google (Pixel Phone Help)",
      "inspected": "2026-10-28",
      "licence": "vendor-fact",
      "kind": "published"
    },
    {
      "id": "aosp-nexus-xml",
      "url": "https://android.googlesource.com/platform/tools/base/+/mirror-goog-studio-main/sdklib/src/main/resources/com/android/sdklib/devices/nexus.xml",
      "publisher": "AOSP (platform/tools/base sdklib)",
      "inspected": "2026-10-28",
      "licence": "Apache-2.0",
      "kind": "published",
      "revision": "mirror-goog-studio-main b143674a31236684a225ec6d6d19a5c9b1ecef51 (2026-10-28)",
      "note": "Google device emulator profiles (Pixel Fold, Pixel 9 Pro Fold, Pixel 10 Pro Fold, Pixel Tablet, Pixel 10 Pro). One pixel-density per profile, applied to the folded region too."
    },
    {
      "id": "android-screen-densities",
      "url": "https://developer.android.com/training/multiscreen/screendensities",
      "publisher": "Google (Android Developers)",
      "inspected": "2026-10-28",
      "licence": "CC-BY-4.0",
      "kind": "published",
      "quote": "px = dp * (dpi / 160)",
      "note": "mdpi 160 = 1.0 baseline; xhdpi 320 = 2.0; xxhdpi 480 = 3.0; 420dpi = 2.625; 390dpi = 2.4375."
    },
    {
      "id": "androidx-foldingfeature",
      "url": "https://android.googlesource.com/platform/frameworks/support/+/androidx-main/window/window/src/main/java/androidx/window/layout/FoldingFeature.kt",
      "publisher": "AOSP (androidx.window)",
      "inspected": "2026-10-28",
      "licence": "Apache-2.0",
      "kind": "published",
      "revision": "androidx-main (read 2026-10-28)",
      "note": "State FLAT | HALF_OPENED; Orientation VERTICAL | HORIZONTAL; OcclusionType NONE (flexible screen, treat as guideline) | FULL (hinge is part of the window); isSeparating true for hinges always and for folds when not FLAT."
    },
    {
      "id": "w3c-device-posture",
      "url": "https://www.w3.org/TR/device-posture/",
      "publisher": "W3C Devices and Sensors WG",
      "inspected": "2026-10-28",
      "licence": "W3C-document-licence",
      "kind": "published",
      "revision": "Candidate Recommendation Draft 2026-10-26",
      "quote": "continuous | folded",
      "note": "continuous = flat or fully closed; folded = book or laptop posture."
    },
    {
      "id": "foldproof-derivation",
      "url": "https://github.com/La-Cappuccino/foldproof/blob/main/docs/research/02-device-profile-sources.md",
      "publisher": "foldproof (this corpus)",
      "inspected": "2026-10-28",
      "licence": "CDLA-Permissive-2.0",
      "kind": "derived",
      "note": "Values computed by the corpus author from the other listed sources; each derived entry states its formula in `derivation`."
    }
  ],
  "panels": [
    {
      "name": "inner",
      "physical_px": {
        "w": 2076,
        "h": 2152
      },
      "diagonal_in": 8,
      "ppi": 373,
      "density_dpi": 390,
      "source_ref": "google-pixel-specs"
    },
    {
      "name": "outer",
      "physical_px": {
        "w": 1080,
        "h": 2364
      },
      "diagonal_in": 6.4,
      "ppi": 408,
      "density_dpi": 390,
      "source_ref": "google-pixel-specs"
    }
  ],
  "logical": [
    {
      "panel": "inner",
      "orientation": "portrait",
      "unit": "dp",
      "w": 851.69,
      "h": 882.87,
      "scale": 2.4375,
      "kind": "derived",
      "derivation": "dp = px / (390 / 160): 2076 / 2.4375 = 851.69; 2152 / 2.4375 = 882.87 (density from AOSP nexus.xml pixel_10_pro_fold, px from Google)",
      "source_ref": "aosp-nexus-xml"
    },
    {
      "panel": "inner",
      "orientation": "landscape",
      "unit": "dp",
      "w": 882.87,
      "h": 851.69,
      "scale": 2.4375,
      "kind": "derived",
      "derivation": "swap of portrait dp",
      "source_ref": "aosp-nexus-xml"
    },
    {
      "panel": "outer",
      "orientation": "portrait",
      "unit": "dp",
      "w": 443.08,
      "h": 969.85,
      "scale": 2.4375,
      "kind": "derived",
      "derivation": "dp = px / 2.4375 using the single AOSP profile density: 1080 / 2.4375 = 443.08; 2364 / 2.4375 = 969.85; retail outer panel is 408 ppi so hardware density may differ",
      "source_ref": "aosp-nexus-xml"
    }
  ],
  "usable": [
    {
      "panel": "inner",
      "orientation": "portrait",
      "unit": "dp",
      "layout_viewport": {
        "w": 851.69,
        "h": 882.87
      },
      "insets": {
        "top": 0,
        "right": 0,
        "bottom": 0,
        "left": 0
      },
      "cutouts": [],
      "kind": "derived",
      "derivation": "full panel in dp; system insets not published",
      "source_ref": "aosp-nexus-xml"
    },
    {
      "panel": "outer",
      "orientation": "portrait",
      "unit": "dp",
      "layout_viewport": {
        "w": 443.08,
        "h": 969.85
      },
      "insets": {
        "top": 0,
        "right": 0,
        "bottom": 0,
        "left": 0
      },
      "cutouts": [],
      "kind": "derived",
      "derivation": "full panel in dp; system insets not published",
      "source_ref": "aosp-nexus-xml"
    }
  ],
  "display_features": [
    {
      "id": "p10pf-fold-vertical",
      "panel": "inner",
      "type": "fold",
      "orientation": "vertical",
      "bounds": {
        "x": 425.85,
        "y": 0,
        "w": 0,
        "h": 882.87
      },
      "unit": "dp",
      "occlusion": "none",
      "is_separating": true,
      "kind": "derived",
      "derivation": "AOSP nexus.xml hinge areas \"1038-0-0-2152\" / 2.4375 = x 425.85, w 0, h 882.87",
      "source_ref": "aosp-nexus-xml"
    }
  ],
  "postures": [
    {
      "name": "closed",
      "panel": "outer",
      "orientation": "portrait",
      "web": {
        "posture": "continuous",
        "segments": 1
      },
      "android_state": null,
      "hinge_angle_range_deg": [
        0,
        30
      ],
      "source_ref": "aosp-nexus-xml"
    },
    {
      "name": "half_opened",
      "panel": "inner",
      "orientation": "portrait",
      "web": {
        "posture": "folded",
        "segments": 2
      },
      "android_state": "HALF_OPENED",
      "hinge_angle_range_deg": [
        30,
        150
      ],
      "display_feature": "p10pf-fold-vertical",
      "source_ref": "aosp-nexus-xml"
    },
    {
      "name": "book",
      "panel": "inner",
      "orientation": "portrait",
      "web": {
        "posture": "folded",
        "segments": 2
      },
      "android_state": "HALF_OPENED",
      "hinge_angle_range_deg": [
        30,
        150
      ],
      "display_feature": "p10pf-fold-vertical",
      "source_ref": "aosp-nexus-xml"
    },
    {
      "name": "flat",
      "panel": "inner",
      "orientation": "portrait",
      "web": {
        "posture": "continuous",
        "segments": 1
      },
      "android_state": "FLAT",
      "hinge_angle_range_deg": [
        150,
        180
      ],
      "source_ref": "aosp-nexus-xml"
    }
  ],
  "inputs": {
    "pointer": "coarse",
    "hover": "none",
    "touch": true,
    "keyboard": "soft",
    "source_ref": "aosp-nexus-xml"
  },
  "operating_states": [],
  "conflicts_with": [],
  "unknowns": [
    {
      "field": "logical.css_px",
      "reason": "CSS px layout size in Chrome is unknown for both panels: neither Playwright nor DevTools has a Pixel 10 Pro Fold entry and no measurement exists. Inventory-only for the web adapter; it must report this gap rather than derive css_px from dp."
    },
    {
      "field": "display_features.bounds",
      "reason": "Hardware fold bounds unmeasured; the dp feature is the AOSP emulator line."
    },
    {
      "field": "panels.outer.density_dpi",
      "reason": "Outer panel density on hardware unknown; AOSP applies 390dpi to both regions."
    },
    {
      "field": "panels.dimensions_mm",
      "reason": "Dimensions and weight are on the Google page (folded 155.2 x 76.3 x 10.8 mm; unfolded 155.2 x 150.4 x 5.2 mm; 258 g) but are not modelled in this schema."
    },
    {
      "field": "usable.insets",
      "reason": "System insets (status bar, navigation bar) and cutout geometry are not published; insets recorded as 0, meaning \"not published\", not \"none\"."
    },
    {
      "field": "keyboard_height",
      "reason": "No published or cited community measurement of the soft keyboard height for this device; measure at test time (visualViewport.height delta or env(keyboard-inset-height)). Never defaulted."
    }
  ],
  "tags": [
    "foldable",
    "phone"
  ]
}
