{
  "$schema": "../schemas/profile.schema.json",
  "id": "android-tv-1080p",
  "revision": 1,
  "kind": "emulator-profile",
  "platform": "tv",
  "name": "AOSP emulator profile: Television (1080p)",
  "sources": [
    {
      "id": "aosp-tv-xml",
      "url": "https://android.googlesource.com/platform/tools/base/+/mirror-goog-studio-main/sdklib/src/main/resources/com/android/sdklib/devices/tv.xml",
      "publisher": "AOSP (platform/tools/base sdklib)",
      "inspected": "2026-10-28",
      "licence": "Apache-2.0",
      "kind": "published",
      "revision": "mirror-goog-studio-main b143674a31236684a225ec6d6d19a5c9b1ecef51 (2026-10-28)",
      "quote": "Television (1080p): 1920 x 1080, xhdpi, 55.0 in"
    },
    {
      "id": "android-tv-layouts",
      "url": "https://developer.android.com/training/tv/playback/compose/layouts",
      "publisher": "Google (Android Developers)",
      "inspected": "2026-10-28",
      "licence": "CC-BY-4.0",
      "kind": "published",
      "quote": "Adding a 5% margin of 48 dp on the left and right edges and 27 dp on the top and bottom edges to a layout helps ensure that screen elements in the layout are within the overscan-safe area.",
      "note": "720p = tvdpi, 1080p = xhdpi, 4K = xxxhdpi. D-pad remote; no swipe-only gestures; viewer at 10 feet."
    },
    {
      "id": "android-screen-densities",
      "url": "https://developer.android.com/training/multiscreen/screendensities",
      "publisher": "Google (Android Developers)",
      "inspected": "2026-10-28",
      "licence": "CC-BY-4.0",
      "kind": "published",
      "quote": "px = dp * (dpi / 160)",
      "note": "mdpi 160 = 1.0 baseline; xhdpi 320 = 2.0; xxhdpi 480 = 3.0; 420dpi = 2.625; 390dpi = 2.4375."
    },
    {
      "id": "foldproof-derivation",
      "url": "https://github.com/La-Cappuccino/foldproof/blob/main/docs/research/02-device-profile-sources.md",
      "publisher": "foldproof (this corpus)",
      "inspected": "2026-10-28",
      "licence": "CDLA-Permissive-2.0",
      "kind": "derived",
      "note": "Values computed by the corpus author from the other listed sources; each derived entry states its formula in `derivation`."
    }
  ],
  "panels": [
    {
      "name": "single",
      "physical_px": {
        "w": 1920,
        "h": 1080
      },
      "diagonal_in": 55,
      "density_dpi": 320,
      "source_ref": "aosp-tv-xml"
    }
  ],
  "logical": [
    {
      "panel": "single",
      "orientation": "landscape",
      "unit": "dp",
      "w": 960,
      "h": 540,
      "scale": 2,
      "kind": "derived",
      "derivation": "dp = px / (320 / 160): 1920 / 2 = 960; 1080 / 2 = 540 (tv.xml tv_1080p xhdpi; TV guide maps 1080p to xhdpi)",
      "source_ref": "aosp-tv-xml"
    },
    {
      "panel": "single",
      "orientation": "landscape",
      "unit": "css_px",
      "w": 960,
      "h": 540,
      "scale": 2,
      "kind": "derived",
      "derivation": "css_px = dp at 100% zoom if a Chromium browser runs on the TV; unmeasured",
      "source_ref": "aosp-tv-xml"
    }
  ],
  "usable": [
    {
      "panel": "single",
      "orientation": "landscape",
      "unit": "dp",
      "layout_viewport": {
        "w": 960,
        "h": 540
      },
      "insets": {
        "top": 27,
        "right": 48,
        "bottom": 27,
        "left": 48
      },
      "cutouts": [],
      "kind": "published",
      "derivation": "overscan-safe margins 48 dp left/right and 27 dp top/bottom from the TV layouts guide; safe area = 864 x 486 dp",
      "source_ref": "android-tv-layouts"
    },
    {
      "panel": "single",
      "orientation": "landscape",
      "unit": "css_px",
      "layout_viewport": {
        "w": 960,
        "h": 540
      },
      "insets": {
        "top": 27,
        "right": 48,
        "bottom": 27,
        "left": 48
      },
      "cutouts": [],
      "kind": "derived",
      "derivation": "same as dp at scale 2 (css_px = dp)",
      "source_ref": "android-tv-layouts"
    }
  ],
  "display_features": [],
  "postures": [],
  "inputs": {
    "pointer": "none",
    "hover": "none",
    "touch": false,
    "keyboard": "none",
    "remote_dpad": true,
    "source_ref": "android-tv-layouts"
  },
  "operating_states": [],
  "conflicts_with": [],
  "unknowns": [
    {
      "field": "logical.css_px",
      "reason": "Browser availability on Android TV is not modelled; css_px is a derived assumption that a Chromium browser would map dp 1:1."
    },
    {
      "field": "usable.insets",
      "reason": "Real overscan varies per TV; the 48/27 dp margin is guidance, not a measurement."
    },
    {
      "field": "inputs.keyboard",
      "reason": "An on-screen keyboard exists for text entry via D-pad; recorded as keyboard none because there is no soft keyboard occlusion model for TV."
    }
  ],
  "tags": [
    "tv"
  ]
}
